{
  "$schema": "https://json-schema.org/draft/2020-12/schema",
  "$id": "https://github.com/mlainz/recetas/recipe.schema.json",
  "title": "Receta",
  "description": "Una receta, tal y como se guarda en recetas/<slug>.json. Un fichero, una receta.",
  "type": "object",
  "additionalProperties": false,
  "required": ["title", "ingredients", "instructions", "time", "servings", "tags", "image"],
  "properties": {
    "title": {
      "type": "string",
      "description": "Nombre de la receta, en castellano y con acentos.",
      "minLength": 1
    },
    "description": {
      "type": "string",
      "description": "Resumen breve del plato. Opcional."
    },
    "ingredients": {
      "type": "array",
      "minItems": 1,
      "items": {
        "type": "object",
        "additionalProperties": false,
        "required": ["name", "quantity", "unit"],
        "properties": {
          "name": {
            "type": "string",
            "description": "Nombre del ingrediente, con la primera letra en mayúscula.",
            "minLength": 1
          },
          "quantity": {
            "type": ["number", "null"],
            "description": "Cantidad. null cuando la receta no la especifica."
          },
          "unit": {
            "type": "string",
            "description": "Unidad. Vocabulario en uso: g, ml, ud, uds, cda (cucharada), cdta (cucharadita), puñado, chorro, 'al gusto', 'cantidad necesaria'.",
            "minLength": 1
          }
        }
      }
    },
    "instructions": {
      "type": "array",
      "minItems": 1,
      "items": {
        "type": "object",
        "additionalProperties": false,
        "required": ["description"],
        "properties": {
          "description": {
            "type": "string",
            "description": "Un paso de la elaboración. Sin numerar: el orden lo da el array.",
            "minLength": 1
          },
          "image": {
            "type": ["string", "null"],
            "description": "Fichero de imagen dentro de imagenes/ para este paso. Opcional."
          }
        }
      }
    },
    "time": {
      "type": ["string", "null"],
      "description": "Tiempo total, p. ej. '30m' o '1h 30m'. null si la receta no lo dice."
    },
    "servings": {
      "type": ["number", "null"],
      "description": "Número de comensales. null si la receta no lo dice."
    },
    "tags": {
      "type": "array",
      "description": "Etiquetas en minúscula y en castellano, p. ej. guiso, vegetariano, pasta.",
      "items": { "type": "string", "minLength": 1 }
    },
    "image": {
      "type": ["string", "null"],
      "description": "Fichero de imagen principal dentro de imagenes/, p. ej. 'Caponata_siciliana.jpeg'. null si no hay foto."
    }
  }
}
