{
    "title": "Curry de lentejas",
    "description": "Lentejas con un curry suave, acompañadas de boniato que les da un punto dulce.",
    "ingredients": [
        {
            "name": "Lentejas",
            "quantity": 250,
            "unit": "g"
        },
        {
            "name": "Boniato",
            "quantity": 1,
            "unit": "ud"
        },
        {
            "name": "Diente de ajo",
            "quantity": 1,
            "unit": "ud"
        },
        {
            "name": "Tomate triturado (o tomate natural y concentrado)",
            "quantity": 400,
            "unit": "g"
        },
        {
            "name": "Cebolla dulce",
            "quantity": 1,
            "unit": "ud"
        },
        {
            "name": "Especias para curry (cúrcuma, comino, cilantro, jengibre)",
            "quantity": null,
            "unit": "al gusto"
        },
        {
            "name": "Pimentón picante",
            "quantity": null,
            "unit": "al gusto"
        },
        {
            "name": "Pimienta",
            "quantity": null,
            "unit": "al gusto"
        },
        {
            "name": "Sal",
            "quantity": null,
            "unit": "al gusto"
        }
    ],
    "instructions": [
        {
            "description": "Poner en una olla las lentejas y el boniato cortado en trozos grandes. Añadir agua y hervir suavemente."
        },
        {
            "description": "Preparar una salsa de tomate: sofreír la cebolla y el ajo. Cuando esté blanda, añadir el pimentón picante, remover y añadir el tomate antes de que se queme. Añadir el resto de especias al tomate."
        },
        {
            "description": "Cuando el tomate esté listo y las lentejas estén casi hechas, mezclar todo en la olla."
        }
    ],
    "time": null,
    "servings": null,
    "tags": [
        "guiso",
        "curry",
        "vegetariano"
    ],
    "image": null
}
