{
    "title": "Pollo con champiñones al vino blanco",
    "description": "Guiso de pollo con champiñones al vino blanco.",
    "ingredients": [
        {
            "name": "Muslos y contramuslos de pollo",
            "quantity": 4,
            "unit": "uds"
        },
        {
            "name": "Champiñones",
            "quantity": 250,
            "unit": "g"
        },
        {
            "name": "Cebollas dulces",
            "quantity": 2,
            "unit": "uds"
        },
        {
            "name": "Vino blanco",
            "quantity": 400,
            "unit": "ml"
        },
        {
            "name": "Caldo de verduras",
            "quantity": null,
            "unit": "cantidad necesaria"
        },
        {
            "name": "Vino tinto",
            "quantity": null,
            "unit": "chorro"
        },
        {
            "name": "Mantequilla",
            "quantity": 75,
            "unit": "g"
        },
        {
            "name": "Aceite de oliva",
            "quantity": null,
            "unit": "al gusto"
        },
        {
            "name": "Harina",
            "quantity": null,
            "unit": "cantidad necesaria"
        },
        {
            "name": "Especias: romero, tomillo, nuez moscada, pimienta, guindilla",
            "quantity": null,
            "unit": "al gusto"
        }
    ],
    "instructions": [
        {
            "description": "Salpimentar, enharinar y sellar el pollo en una cazuela a fuego fuerte y reservarlo."
        },
        {
            "description": "Picar y sofreír la cebolla. Cuando esté blanda, añadir los champiñones y sofreír 5 min."
        },
        {
            "description": "Verter el vino y poner a ebullición hasta que se evapore todo el alcohol."
        },
        {
            "description": "Agregar el pollo y las especias. Cocinar a fuego lento 45 min."
        },
        {
            "description": "Dejar reposar y servir."
        }
    ],
    "time": null,
    "servings": null,
    "tags": [
        "guiso",
        "pollo"
    ],
    "image": null
}
